{
  "$schema": "https://json-schema.org/draft/2020-12/schema",
  "type": "object",
  "required": ["schema_version", "policy_version", "threshold_frozen", "score_metric", "comparison_operator", "score_threshold", "candidate_threshold", "positive_floor", "negative_ceiling", "separation_gap", "positive_margin", "negative_margin", "selection_method", "operational_rounding", "calibration_top_k", "supported_case_count", "unsupported_case_count", "calibration_attempt_used", "discarded_attempt_count", "calibration_logical_api_calls", "historical_logical_api_calls", "generation_api_calls", "embedding_provider", "embedding_model", "embedding_dimensions", "collection_name", "distance", "total_points", "index_manifest_sha256", "calibration_summary_sha256", "chunks_sha256", "processed_manifest_sha256", "index_plan_sha256"],
  "properties": {
    "schema_version": {"const": "1.0"}, "policy_version": {"const": "retrieval-threshold-v1"}, "threshold_frozen": {"const": true}, "score_metric": {"const": "cosine_similarity"}, "comparison_operator": {"const": "greater_than_or_equal"},
    "score_threshold": {"type": "number", "minimum": -1, "maximum": 1, "const": 0.46}, "candidate_threshold": {"type": "number", "const": 0.458789}, "positive_floor": {"type": "number", "const": 0.56656004}, "negative_ceiling": {"type": "number", "const": 0.35101858}, "separation_gap": {"type": "number", "minimum": 0.03, "const": 0.21554146}, "positive_margin": {"type": "number", "const": 0.10656004}, "negative_margin": {"type": "number", "const": 0.10898142},
    "selection_method": {"const": "midpoint_between_positive_floor_and_negative_ceiling"}, "operational_rounding": {"const": "rounded_to_two_decimal_places"}, "calibration_top_k": {"type": "integer", "const": 5}, "supported_case_count": {"type": "integer", "const": 6}, "unsupported_case_count": {"type": "integer", "const": 3}, "calibration_attempt_used": {"type": "integer", "const": 2}, "discarded_attempt_count": {"type": "integer", "const": 1}, "calibration_logical_api_calls": {"type": "integer", "const": 9}, "historical_logical_api_calls": {"type": "integer", "const": 10}, "generation_api_calls": {"type": "integer", "const": 0},
    "embedding_provider": {"const": "openai"}, "embedding_model": {"const": "text-embedding-3-small"}, "embedding_dimensions": {"type": "integer", "const": 1536}, "collection_name": {"const": "nexodocs_chunks_v1"}, "distance": {"const": "Cosine"}, "total_points": {"type": "integer", "const": 44},
    "index_manifest_sha256": {"type": "string", "pattern": "^[0-9a-f]{64}$", "const": "cb9c47e0ef4a62771b15894bcfcbfbb6966af588169ebc17427ed00f14906b79"}, "calibration_summary_sha256": {"type": "string", "pattern": "^[0-9a-f]{64}$", "const": "76018894dab8fa27af0dfb34ce80f06de7378eaf299bcbcf872dda9e52ebfdb4"}, "chunks_sha256": {"type": "string", "pattern": "^[0-9a-f]{64}$", "const": "a49ad2a4c3b8dc767277566be60e93cd2a8d3113ffe1c598eec9ccfb759b02c4"}, "processed_manifest_sha256": {"type": "string", "pattern": "^[0-9a-f]{64}$", "const": "9f2a32488d6a46083df39de0121cd6df62f2be7fae7de4981bab31c1f801edca"}, "index_plan_sha256": {"type": "string", "pattern": "^[0-9a-f]{64}$", "const": "5c7be0bfb3f6d79ae173611436599efaf8af9036e4bc532c8cee0a754fbf9d28"}
  },
  "additionalProperties": false
}
