{
  "schema_version": "1.0",
  "policy_version": "retrieval-threshold-v1",
  "threshold_frozen": true,
  "score_metric": "cosine_similarity",
  "comparison_operator": "greater_than_or_equal",
  "score_threshold": 0.46,
  "candidate_threshold": 0.458789,
  "positive_floor": 0.56656004,
  "negative_ceiling": 0.35101858,
  "separation_gap": 0.21554146,
  "positive_margin": 0.10656004,
  "negative_margin": 0.10898142,
  "selection_method": "midpoint_between_positive_floor_and_negative_ceiling",
  "operational_rounding": "rounded_to_two_decimal_places",
  "calibration_top_k": 5,
  "supported_case_count": 6,
  "unsupported_case_count": 3,
  "calibration_attempt_used": 2,
  "discarded_attempt_count": 1,
  "calibration_logical_api_calls": 9,
  "historical_logical_api_calls": 10,
  "generation_api_calls": 0,
  "embedding_provider": "openai",
  "embedding_model": "text-embedding-3-small",
  "embedding_dimensions": 1536,
  "collection_name": "nexodocs_chunks_v1",
  "distance": "Cosine",
  "total_points": 44,
  "index_manifest_sha256": "cb9c47e0ef4a62771b15894bcfcbfbb6966af588169ebc17427ed00f14906b79",
  "calibration_summary_sha256": "76018894dab8fa27af0dfb34ce80f06de7378eaf299bcbcf872dda9e52ebfdb4",
  "chunks_sha256": "a49ad2a4c3b8dc767277566be60e93cd2a8d3113ffe1c598eec9ccfb759b02c4",
  "processed_manifest_sha256": "9f2a32488d6a46083df39de0121cd6df62f2be7fae7de4981bab31c1f801edca",
  "index_plan_sha256": "5c7be0bfb3f6d79ae173611436599efaf8af9036e4bc532c8cee0a754fbf9d28"
}
